{
  "MessageId": "1639693510094-Registry/openindustry4.com/nd/nd/nd",
  "MessageType": "ua-metadata",
  "PublisherId": "Registry/openindustry4.com/nd/nd/nd",
  "DataSetWriterId": 753,
  "WriterGroupName": "oee",
  "DataSetWriterName": "openindustry4.com/nd/nd/nd",
  "ReplyTo": "1639693510000-Registry/openindustry4.com/nd/nd/nd",
  "MetaData": {
    "Name": "Dataset1",
    "Description": {
      "Text": "Description",
      "Locale": "en-US"
    },
    "Namespaces": [],
    "StructureDataTypes": [],
    "EnumDataTypes": [],
    "SimpleDataTypes": []
  }
}
